<?xml version="1.0" encoding="UTF-8"?>
<vpr:PurRequestFull xmlns:vpr="http://www.solazyme.com/PurchaseRequest" xmlns:xsi="http://www.w3.org/2001/XMLSchema-instance" xsi:schemaLocation="http://www.solazyme.com/PurchaseRequest PurchaseRequest.xsd ">
  <vpr:RFQMain>
    <vpr:PurReqID>0</vpr:PurReqID>
    <vpr:PurReqName>vpr:PurReqName</vpr:PurReqName>
    <vpr:PurUserID>vpr:PurUserID</vpr:PurUserID>
    <vpr:PurDep>vpr:PurDep</vpr:PurDep>
    <vpr:PurVendor>vpr:PurVendor</vpr:PurVendor>
    <vpr:PurDateReq>2001-01-01</vpr:PurDateReq>
    <vpr:Shipping>vpr:Shipping</vpr:Shipping>
    <vpr:PurSubmit>2001-01-01</vpr:PurSubmit>
    <vpr:PurTotalQuantPr>0</vpr:PurTotalQuantPr>
    <vpr:PurTotalCost>0.0</vpr:PurTotalCost>
    <vpr:PurReason>vpr:PurReason</vpr:PurReason>
    <vpr:PurComments>vpr:PurComments</vpr:PurComments>
  </vpr:RFQMain>
  <vpr:RFQDetail>
    <vpr:PRQLineItem>
      <vpr:LineItemID>0</vpr:LineItemID>
      <vpr:PurRequestID>0</vpr:PurRequestID>
      <vpr:PurOrderID>0</vpr:PurOrderID>
      <vpr:LineProductNum>vpr:LineProductNum</vpr:LineProductNum>
      <vpr:Quantity>0</vpr:Quantity>
      <vpr:ItemCost>0.0</vpr:ItemCost>
      <vpr:TotalCost>0.0</vpr:TotalCost>
      <vpr:Description>vpr:Description</vpr:Description>
      <vpr:Received>true</vpr:Received>
    </vpr:PRQLineItem>
    <vpr:PRQLineItem>
      <vpr:LineItemID>2</vpr:LineItemID>
      <vpr:PurRequestID>0</vpr:PurRequestID>
      <vpr:PurOrderID>0</vpr:PurOrderID>
      <vpr:LineProductNum>vpr:LineProductNum</vpr:LineProductNum>
      <vpr:Quantity>0</vpr:Quantity>
      <vpr:ItemCost>0.0</vpr:ItemCost>
      <vpr:TotalCost>0.0</vpr:TotalCost>
      <vpr:Description>vpr:Description</vpr:Description>
      <vpr:Received>true</vpr:Received>
    </vpr:PRQLineItem>
  </vpr:RFQDetail>
</vpr:PurRequestFull>
